{"protocol_version":"atlas-richie.sentinel.managed-rule-publication/v1","binding_id":"binding-02","publication_id":"publication-43","target_version_id":"version-43","publication_sequence":43,"rule_kind":"flow","profile_id":"sentinel-nacos-flow-v1","payload_sha256":"56bcfa001340bd02000b96afc9108918f4173531881bc5e2c23a8a7784c19943","rule_payload":"[{\"resource\":\"订单\",\"grade\":1,\"count\":10}]"}
